{
  "protocol_id": "RP-001",
  "review_type": "methodological",
  "research_question": "在曲面超声检测中，不同成像方法在何种条件下具有可比的定位表现？",
  "scope": {"population": "curved-surface ultrasonic inspection"},
  "eligibility": {"include": ["original experiments"], "exclude": ["no evaluation conditions"]},
  "databases": ["Web of Science"],
  "date_range": {"from": "2015", "to": "2026"},
  "screening": {"title_abstract": "dual_check"},
  "appraisal": {"method": "condition completeness"},
  "synthesis": {"dimensions": ["input", "calibration", "metric", "truth"]},
  "reporting": {"guideline": null},
  "registration": null,
  "deviations": [],
  "version": "v001",
  "status": "proposed"
}
